"","DBN","School Name","SAT Critical Reading Avg. Score","SAT Math Avg. Score","SAT Writing Avg. Score","School Type","Parent Response Rate","frl_percent","ell_percent","asian_per","black_per","hispanic_per","white_per","male_per","female_per","sped_percent","total_enrollment","Num of SAT Test Takers"
"1","01M292","Henry Street School For International Studies","355","404","363","Middle/High School","26%",88.6,22.3,14,29.1,53.8,1.7,61.4,38.6,24.9,422,"29"
"2","01M448","University Neighborhood High School","383","423","366","High School","26%",71.8,21.1,29.2,22.6,45.9,2.3,57.4,42.6,21.8,394,"91"
"3","01M450","East Side Community School","377","402","370","Middle/High School","29%",71.8,5,9.7,23.9,55.4,10.4,54.7,45.3,26.4,598,"70"
"4","01M458","Forsyth Satellite Academy","414","401","359","Transfer High School","17%",72.8,4,2.2,34.4,59.4,3.6,43.3,56.7,8.9,224,"7"
"5","01M509","Marta Valle High School","390","433","384","High School","13%",80.7,11.2,9.3,31.6,56.9,1.6,46.3,53.7,25.9,367,"44"
"6","01M515","Lower East Side Preparatory High School","332","557","316","Transfer High School","76%",77,80.6,84.7,5.2,8.9,0.9,53.7,46.3,1.2,562,"112"
"7","01M539","New Explorations Into Science, Technology And Math","522","574","525","Elementary/Middle/High School","60%",23,0.2,27.8,11.7,14.2,44.9,49.2,50.8,2.7,1613,"159"
"8","01M650","Cascades High School","417","418","411","Transfer High School","29%",69.8,3.2,0.5,45.4,49.5,4.1,39.9,60.1,6.9,218,"18"
"9","01M696","Bard High School Early College","624","604","628","High School","47%",18,0.2,15.1,15.1,18.2,49.8,31.3,68.7,0.8,617,"130"
"10","02M047","47 The American Sign Language And English Secondar","395","400","387","High School","48%",66.9,8,1.7,32.2,59.2,6.3,42.5,57.5,32.2,174,"16"
"11","02M288","Food And Finance High School","409","393","392","High School","7%",68.4,2.1,3,44.1,47.6,4.8,45,55,18.5,433,"62"
"12","02M294","Essex Street Academy","394","384","378","High School","29%",60.8,3.8,4.1,27.7,60.6,7.6,53.4,46.6,20.4,343,"53"
"13","02M296","High School Of Hospitality Management","374","375","362","High School","41%",72.4,9.5,5.3,26.5,66.1,2.1,32.2,67.8,14.8,419,"58"
"14","02M298","Pace High School","423","438","432","High School","78%",56.7,2.2,10.1,32.4,42,3.9,43.7,56.3,13.8,414,"85"
"15","02M300","Urban Assembly School Of Design And Construction,","404","449","416","High School","30%",75.3,10.9,6,29.2,59.2,4.9,74.9,25.1,20,431,"48"
"16","02M303","Facing History School, The","353","358","340","High School","73%",75.6,20.8,0.7,23.5,73.2,2.4,50.6,49.4,21.7,451,"76"
"17","02M305","Urban Assembly Academy Of Government And Law, The","375","388","385","High School","9%",68.3,6.1,3.8,41.7,50.6,3.5,43.9,56.1,17,312,"50"
"18","02M308","Lower Manhattan Arts Academy","403","392","405","High School","13%",62.2,3.9,9.5,30.7,55.7,3.6,39.9,60.1,24.7,336,"40"
"19","02M313","James Baldwin School, The: A School For Expedition","408","390","390","Transfer High School","16%",51,4.8,4,34.3,54.4,6.5,52.4,47.6,12.9,248,"69"
"20","02M316","Urban Assembly School Of Business For Young Women,","373","370","384","High School","60%",74.9,2.6,3.4,46.8,48.4,1.3,0,100,15.6,378,"42"
"21","02M374","Gramercy Arts High School","391","391","394","High School","68%",59,3,2.8,45.3,45.1,6.7,26.3,73.7,12.3,495,"60"
"22","02M376","Nyc Ischool","473","483","479","High School","37%",34.6,0.5,11.5,20.6,43,24,48.7,51.3,10.9,433,"92"
"23","02M392","Manhattan Business Academy","s","s","s","High School","17%",64,9.9,6.6,29.5,58.7,4.8,59,41,13.9,332,"s"
"24","02M393","Business Of Sports School","s","s","s","High School","26%",58.7,7.6,1.6,35.5,57.2,4.3,72.4,27.6,21.4,304,"s"
"25","02M394","Emma Lazarus High School","319","512","357","Transfer High School","95%",97,82.8,62.4,7.2,26.4,4,51.2,48.8,0,250,"79"
"26","02M399","The High School For Language And Diplomacy","s","s","s","High School","15%",80.8,28.3,44.3,15.6,32.8,5.3,48,52,16.8,244,"s"
"27","02M400","High School For Environmental Studies","465","493","461","High School","10%",56.4,7.1,16.7,14.8,57.2,11.1,50.4,49.6,14.4,1394,"263"
"28","02M407","Institute For Collaborative Education","492","465","467","Middle/High School","30%",17.9,0.4,6.3,10.2,17.6,54.6,55.2,44.8,8.8,489,"54"
"29","02M408","Professional Performing Arts High School","509","490","523","Middle/High School","45%",23.5,2,7,19.1,23.7,41.8,25.3,74.7,3.2,502,"94"
"30","02M411","Baruch College Campus High School","496","563","518","High School","29%",54.6,1.6,60.6,5.8,14.6,18.8,44,56,2.3,432,"104"
"31","02M412","N.Y.C. Lab School For Collaborative Studies","537","590","550","High School","27%",21.6,1.6,29.4,8.5,14,45.9,47,53,15,579,"114"
"32","02M413","School Of The Future High School","517","533","515","Middle/High School","46%",31,2.1,16,12.3,26,38,50.8,49.2,14.6,673,"66"
"33","02M414","N.Y.C. Museum School","468","492","459","High School","50%",51.6,0.5,33,11.7,39.9,15.4,42.4,57.6,9.4,436,"103"
"34","02M416","Eleanor Roosevelt High School","572","594","592","High School","39%",15.8,0.2,17.2,5.5,11.6,63.7,32.5,67.5,1.2,507,"127"
"35","02M418","Millennium High School","528","553","533","High School","47%",32.7,0.2,30,8.8,21.7,35.9,38.2,61.8,9.1,626,"144"
"36","02M419","Landmark High School","390","399","381","High School","45%",83.1,15.7,5.2,18.1,74.8,1.9,48.5,51.5,18.8,421,"62"
"37","02M420","High School For Health Professions And Human Servi","429","449","428","High School","48%",68,4,20.5,24.4,49.7,5.3,29.4,70.6,10.9,1768,"336"
"38","02M425","Leadership And Public Service High School","416","426","391","High School","6%",74.2,5.4,8.1,30.5,54.2,6.6,46.1,53.9,18.6,607,"84"
"39","02M427","Manhattan Academy For Arts & Language","s","s","s","High School","61%",97.5,86.9,6.3,8,84.6,1.1,54.9,45.1,6.9,175,"s"
"40","02M429","Legacy School For Integrated Studies","356","357","349","High School","21%",93.9,8.2,1.4,45.2,51.4,1.7,49,51,22.4,294,"29"
"41","02M437","Hudson High School Of Learning Technologies","s","s","s","High School","47%",61.5,8.8,5.8,23.5,62.4,6.6,60.6,39.4,16.4,226,"s"
"42","02M438","International High School At Union Square","s","s","s","High School","28%",82.8,94.9,40.3,12.5,43.2,3.4,61.4,38.6,0.6,176,"s"
"43","02M439","Manhattan Village Academy","441","473","458","High School","74%",60.3,3.7,6.3,16.8,71.8,4.9,38.5,61.5,8.2,429,"95"
"44","02M440","Bayard Rustin Educational Complex","378","365","368","High School","20%",75.5,26,6.3,27.9,62.5,2.4,63.9,36.1,13.5,208,"59"
"45","02M449","Vanguard High School","395","416","388","High School","19%",69.5,6.1,9.9,25.7,59,4.5,46.2,53.8,17.3,444,"72"
"46","02M459","Manhattan International High School","376","460","391","High School","39%",80.7,77.5,33.5,14.8,36.9,14.5,44.3,55.7,0.3,325,"49"
"47","02M460","Washington Irving High School","373","387","360","High School","24%",66,18.6,4.8,34.3,58.2,2.3,47.5,52.5,17.2,1032,"151"
"49","02M475","Stuyvesant High School","679","735","682","High School","23%",30.3,0,72.1,1.2,2.4,23.7,59.3,40.7,0.4,3297,"832"
"50","02M489","High School Of Economics And Finance","443","489","442","High School","47%",60.8,6.3,24.8,22.5,43.5,8.8,54.5,45.5,11.9,809,"167"
"51","02M500","Unity Center For Urban Technologies","370","349","351","High School","75%",83.5,15.6,3.8,35,55.3,2.5,62.4,37.6,32.9,237,"25"
"52","02M519","Talent Unlimited High School","469","472","475","High School","30%",45.5,0.2,4.5,36,39.3,19.8,21.4,78.6,3.5,491,"81"
"53","02M520","Murry Bergtraum High School For Business Careers","407","440","393","High School","4%",72.7,10.2,10.5,39.9,46.6,2.3,49.1,50.9,14.1,2073,"264"
"54","02M529","Jacqueline Kennedy Onassis High School","414","425","400","High School","16%",73,9.8,5.1,22.7,69.9,1.8,40.6,59.4,13.7,724,"131"
"55","02M531","Repertory Company High School For Theatre Arts","429","404","420","High School","36%",65.3,0.5,1.4,47.9,42.4,7.4,21.2,78.8,5.1,217,"42"
"56","02M542","Manhattan Bridges High School","336","378","344","High School","68%",83.5,72.6,0.2,0,99.8,0,51.4,48.6,1.7,541,"66"
"57","02M543","New Design High School","391","395","382","High School","5%",66.1,5.4,3.8,30.3,62.2,2.6,38.3,61.7,17.5,423,"73"
"58","02M544","Independence High School","389","371","335","Transfer High School","19%",74.4,3.8,4.3,33.5,59.6,2,51.2,48.8,11.5,391,"14"
"59","02M545","High School For Dual Language And Asian Studies","412","581","431","High School","47%",82.6,38.2,89.5,3.4,4,2.3,51.3,48.7,2.3,353,"78"
"60","02M550","Liberty High School Academy For Newcomers","368","436","352","Transfer High School","76%",79.5,90.2,25.7,19.9,42.1,11.8,61,39,2,397,"26"
"61","02M551","The Urban Assembly New York Harbor School","405","423","384","High School","35%",73.5,4.2,2.3,37.4,49.3,10.2,60.9,39.1,17.9,430,"77"
"62","02M560","High School M560 - City As School","498","440","477","Transfer High School","4%",38.1,1.3,4.8,37.7,38.8,17.4,43.6,56.4,9.3,605,"56"
"63","02M565","Urban Academy Laboratory High School","527","508","512","Transfer High School","11%",32.1,1.3,5.1,33.8,38.2,20.4,40.8,59.2,0,157,"30"
"64","02M570","Satellite Academy High School","350","337","345","Transfer High School","33%",72.8,6.5,1.6,35.1,59.7,2.8,38.7,61.3,14.1,248,"33"
"65","02M575","Manhattan Comprehensive Night And Day High School","345","517","343","Transfer High School","35%",85.6,60,35.3,31,28.3,5,56.1,43.9,2.4,807,"121"
"66","02M580","Richard R. Green High School Of Teaching","408","384","403","High School","42%",67,6.4,2.3,35.1,59.3,2.3,32.6,67.4,21.8,610,"84"
"67","02M586","Harvey Milk High School","458","416","429","Transfer High School","37%",75.7,1.5,5.9,38.2,39.7,16.2,47.1,52.9,22.1,68,"9"
"68","02M600","The High School Of Fashion Industries","423","423","411","High School","25%",68.3,2.8,3.8,39.1,52.3,4.1,7.3,92.7,11.5,1599,"335"
"69","02M605","Humanities Preparatory Academy","426","403","426","Transfer High School","25%",54,1,7.3,21.9,57.8,11.5,42.7,57.3,6.8,192,"36"
"70","02M615","Chelsea Career And Technical Education High School","399","418","390","High School","28%",69.8,6.2,7.1,29.6,60.5,1.5,65,35,15.7,466,"83"
"71","02M620","Norman Thomas High School","370","379","359","High School","41%",81.1,19.3,1.6,25.6,70.6,2,52,48,15.5,1127,"154"
"72","02M625","High School Of Graphic Communication Arts","395","382","376","High School","26%",72.7,9.1,3.1,30.3,63.8,2.6,46.5,53.5,17.2,1433,"191"
"73","02M630","Art And Design High School","444","441","430","High School","22%",53.3,1.6,9,26.8,51,12.6,46.7,53.3,11.1,1344,"270"
"74","02M655","Life Sciences Secondary School","409","424","403","Middle/High School","9%",70.3,7.9,3.3,28.6,64.3,2.4,51.6,48.4,19.7,717,"61"
"75","03M283","Manhattan Theatre Lab High School","406","379","408","High School","6%",59.6,8.6,1.7,46,49.4,2.2,31.8,68.2,10.5,409,"27"
"76","03M299","High School For Arts, Imagination And Inquiry","374","384","374","High School","21%",66.4,14.4,1,37.3,58.9,1.4,55.7,44.3,19.6,418,"49"
"77","03M307","Urban Assembly School For Media Studies, The","384","390","370","High School","13%",68.8,12.8,2.2,37.4,56,3,57.9,42.1,15.3,366,"41"
"78","03M402","The Urban Assembly School For Green Careers","s","s","s","High School","33%",73.2,25.1,1.8,19.8,76,1.8,56.9,43.1,21.6,283,"s"
"79","03M403","The Global Learning Collaborative","s","s","s","High School","20%",68.4,19.3,3.6,27.7,62.6,5.9,51.4,48.6,19.3,358,"s"
"80","03M404","Innovation Diploma Plus","416","403","381","Transfer High School","44%",50.4,3.5,48.7,33.2,16.6,1.5,47.7,52.3,10.1,199,"12"
"81","03M415","Wadleigh Secondary School For The Performing & Vis","371","368","370","Middle/High School","46%",76.6,7.4,0.4,59.9,38.8,0.8,38.4,61.6,18.8,516,"32"
"82","03M417","Frank Mccourt High School","s","s","s","High School","32%",24,0.9,6.8,18.3,37,37,46.6,53.4,17.4,219,"s"
"83","03M470","Louis D. Brandeis High School","370","390","358","High School","4%",68.6,27.8,2.1,29.6,67.4,1,50.5,49.5,10.7,291,"131"
"84","03M479","Beacon High School","577","575","592","High School","29%",18.4,0.2,8.9,14.6,22.8,49.8,39,61,3.7,1162,"261"
"85","03M485","Fiorello H. Laguardia High School Of Music & Art A","566","564","577","High School","36%",21.7,0.2,19.6,12.9,16.6,49.2,26.4,73.6,1,2605,"531"
"86","03M492","High School For Law, Advocacy And Community Justic","396","398","402","High School","52%",79.9,10.5,1.3,46.2,48.1,1.8,40.1,59.9,15.5,541,"66"
"87","03M494","High School Of Arts And Technology","433","433","411","High School","29%",79.8,10.4,5,34.8,57.2,2.3,67.7,32.3,17.2,603,"75"
"88","03M505","Edward A. Reynolds West Side High School","401","369","351","Transfer High School","14%",70.5,7.8,0.5,34.6,64.4,0.5,44.3,55.7,23,564,"35"
"89","03M541","Manhattan / Hunter Science High School","473","506","467","High School","22%",55.2,1.3,25.6,21.4,41.5,10.2,41.1,58.9,3.8,453,"111"
"90","03M860","Frederick Douglass Academy Ii Secondary School","356","379","361","Middle/High School","49%",64.2,5.8,0.7,77.7,18.9,1.5,54.2,45.8,20.8,413,"43"
"91","04M409","Coalition School For Social Change","354","357","373","High School","18%",71.8,9.7,0.9,39.3,58.7,0.9,44.4,55.6,24.4,349,"48"
"92","04M435","Manhattan Center For Science And Mathematics","461","514","455","High School","21%",71.6,2.7,20.1,19.7,57.4,2.2,46.4,53.6,5.8,1650,"375"
"93","04M495","Park East High School","373","379","376","High School","30%",76.8,4.3,4.9,33.2,59.6,0.3,42.1,57.9,10.6,349,"51"
"94","04M555","Central Park East High School","405","421","395","High School","30%",70.4,4,6.5,26.7,64.5,1.6,32.1,67.9,13.5,445,"73"
"95","04M610","Young Women'S Leadership School","432","446","448","Middle/High School","60%",67.3,2.2,5.1,31.2,60.1,1.6,0,100,6.7,449,"70"
"96","04M635","Academy Of Environmental Science Secondary High Sc","369","369","357","High School","74%",62.7,13.5,4.2,27.6,65.6,2.1,62,38,18.8,192,"48"
"97","04M680","Heritage School, The","358","351","345","High School","51%",71.8,6.8,0.3,28.9,69.4,1,48.6,51.4,24.8,294,"31"
"98","05M285","Harlem Renaissance High School","357","318","333","Transfer High School","24%",67.6,9.5,0.5,62.2,36.9,0.5,39.2,60.8,10.8,222,"29"
"99","05M304","Mott Hall High School","413","399","398","High School","78%",78.5,8.7,0.9,35,63.8,0.2,53.5,46.5,15.5,426,"54"
"100","05M362","Columbia Secondary School","s","s","s","Middle/High School","39%",46.3,0.6,11.6,20,48.5,18.4,49.6,50.4,0.4,474,"s"
"101","05M367","Academy For Social Action: A College Board School","354","366","342","Middle/High School","12%",67,9.9,0.5,61.4,38.1,0,48.7,51.3,21.6,425,"33"
"102","05M369","Urban Assembly School For The Performing Arts","360","353","364","High School","54%",77.7,6.1,0.5,59.1,38.2,0.8,25.4,74.6,16.6,374,"56"
"103","05M469","Choir Academy Of Harlem","354","360","385","Middle/High School","24%",81.9,2,0.3,76.1,22.5,0.6,39.8,60.2,13.3,347,"20"
"104","05M499","Frederick Douglass Academy","458","474","442","Middle/High School","14%",57.6,2.4,1.2,74.4,22.8,1.3,52.2,47.8,8.9,1556,"214"
"105","05M670","Thurgood Marshall Academy For Learning And Social","396","402","404","Middle/High School","41%",65.1,1.4,0.2,78.1,20.9,0.2,44.1,55.9,10,580,"66"
"106","05M685","Bread & Roses Integrated Arts High School","369","361","355","High School","25%",71.8,17.6,0.4,53.2,45.4,0.6,48.9,51.1,21,524,"61"
"107","05M692","High School For Mathematics, Science And Engineeri","605","654","588","High School","41%",18.5,0,36.2,15,21.2,26.1,65.8,34.2,0,406,"101"
"108","06M293","City College Academy Of The Arts","408","446","416","Middle/High School","54%",71.6,6.1,0.7,6,92,1.2,39.6,60.4,13.1,586,"60"
"109","06M346","Community Health Academy Of The Heights","362","376","367","Middle/High School","52%",78.8,30,0.2,5.2,93.8,0.8,52.3,47.7,17.3,520,"55"
"110","06M348","Washington Heights Expeditionary Learning School","380","395","399","Middle/High School","52%",87.5,19.6,0,2.3,96.7,0.3,55.8,44.2,18.1,602,"70"
"111","06M423","High School For Excellence And Innovation","s","s","s","Transfer High School","64%",99.2,19.7,0,25.8,72.5,0,52.8,47.2,34.3,178,"s"
"113","06M462","The College Academy","365","384","378","High School","44%",89.3,43,0.5,5.2,91.4,1.4,63.8,36.2,13.7,630,"76"
"114","06M463","High School For Media And Communications","369","380","349","High School","38%",83.8,26.9,1,10.7,87.1,0.5,63.5,36.5,17,572,"63"
"115","06M467","High School For Law And Public Service","363","378","361","High School","40%",72.5,32,1,13,84.4,1.3,58.6,41.4,16.7,694,"94"
"116","06M468","High School For Health Careers And Sciences","400","422","402","High School","52%",90.7,31.2,0.7,13.7,83.8,1,52.7,47.3,13.8,679,"24"
"117","06M540","A. Philip Randolph Campus High School","430","456","423","High School","9%",76.3,2.3,4,32.8,62.3,0.7,49.9,50.1,5.5,1285,"228"
"118","06M552","Gregorio Luperon High School For Science And Mathe","339","349","326","High School","65%",92.8,89.6,0,0,99.8,0,48.9,51.1,0,472,"56"
"119","07X221","South Bronx Preparatory: A College Board School","364","378","348","Middle/High School","47%",72.9,8.8,0.6,29.9,68.8,0.5,47.4,52.6,19.3,622,"65"
"120","07X321","Crotona Academy High School","379","364","382","Transfer High School","50%",78.3,2.4,0.8,42.7,54,0.8,31.5,68.5,6.5,124,"9"
"121","07X334","International Community High School","310","324","311","High School","46%",77.5,90.1,4.8,20.1,71.8,2,48.6,51.4,1.8,393,"34"
"122","07X379","Jill Chaifetz Transfer High School","s","s","s","Transfer High School","22%",71.7,3,0.5,40.9,56.6,1,36.9,63.1,7.6,198,"s"
"123","07X381","Bronx Haven High School","s","s","s","Transfer High School","32%",64.7,7.8,0.7,35.9,62.7,0.7,37.3,62.7,8.5,153,"s"
"124","07X427","Community School For Social Justice","361","359","357","High School","33%",82.7,13.2,0.6,32.3,65.5,0.9,49.2,50.8,19.7,319,"43"
"125","07X473","Mott Haven Village Preparatory High School","351","375","371","High School","67%",78.5,9.6,1.1,22.6,76,0,50.1,49.9,18.5,363,"63"
"126","07X495","University Heights Secondary School","403","394","404","High School","73%",90.1,3.7,2.6,18.1,78.1,1.3,43.2,56.8,5.2,465,"79"
"127","07X500","Hostos-Lincoln Academy Of Science","420","426","411","Middle/High School","24%",68.3,5.6,2,24,72.7,0.7,45.2,54.8,11.9,538,"66"
"128","07X520","Foreign Language Academy Of Global Studies","399","396","391","High School","42%",89.9,21.9,3.2,26,68.8,1,45.3,54.7,22.5,311,"64"
"129","07X527","Bronx Leadership Academy Ii High School","362","378","363","High School","20%",77,14.1,1.4,41.2,56,1,54,46,18.5,502,"62"
"130","07X547","New Explorers High School","367","356","361","High School","17%",90.4,15.7,0.5,30.3,68.1,0.5,57.7,42.3,25.1,383,"28"
"131","07X548","Urban Assembly School For Careers In Sports","387","411","383","High School","24%",74.3,5,0.4,26.6,70.4,0.4,84.3,15.7,18.7,477,"44"
"132","07X551","Bronx Academy Of Letters","413","381","407","Middle/High School","32%",79.1,9.4,0.5,34.1,64.3,0.9,44.5,55.5,24,555,"51"
"133","07X600","Alfred E. Smith Career And Technical Education Hig","394","400","364","High School","15%",76.7,9.1,1.4,35.9,61.5,0.7,92.7,7.3,22,738,"76"
"134","07X655","Samuel Gompers Career And Technical Education High","398","416","370","High School","11%",75.7,17,1.2,32.4,64.9,0.8,79.6,20.4,26.1,663,"47"
"135","07X670","Health Opportunities High School","363","368","364","High School","83%",77.8,10.4,3.1,39.2,56.9,0.5,28.6,71.4,19.6,587,"114"
"136","08X269","Bronx Studio School For Writers And Artists","s","s","s","Middle/High School","43%",85.6,9.2,1.2,22.4,74.8,1,44,56,13.4,500,"s"
"137","08X282","Women'S Academy Of Excellence","407","386","378","High School","21%",72.2,2.6,2.9,45.9,46.4,2.4,0.3,99.7,15.6,379,"44"
"138","08X293","Renaissance High School For Musical Theater & Tech","384","385","389","High School","31%",66.4,4.5,2.6,25.4,63.8,7.7,38,62,21.7,469,"52"
"139","08X295","Gateway School For Environmental Research And Tech","416","390","394","High School","14%",74.6,11.5,5.6,33.1,59.4,1,60,40,24.1,478,"41"
"140","08X305","Pablo Neruda Academy For Architecture And World St","337","361","340","High School","39%",75.8,15.9,2.5,26.2,69.9,1.4,66,34,27.3,359,"67"
"141","08X312","Millennium Art Academy","387","402","375","High School","16%",74.2,5.4,1.8,32.5,64.3,1,49.2,50.8,20.4,496,"67"
"142","08X332","Holcombe L. Rucker School Of Community Research","363","371","350","High School","71%",79.6,12.6,0.9,39.9,56.8,0.6,49.2,50.8,18,333,"39"
"143","08X367","Archimedes Academy For Math, Science And Technolog","s","s","s","Middle/High School","37%",87.3,2.6,2.8,35,60.2,2,62,38,22,500,"s"
"144","08X376","Antonia Pantoja Preparatory Academy, A College Boa","s","s","s","Middle/High School","32%",81.3,7.4,4.9,27.8,66,0.7,47,53,24.1,432,"s"
"145","08X377","Bronx Community High School","367","369","376","Transfer High School","43%",73.9,4.5,1,33,63.5,1,50.5,49.5,5,200,"9"
"146","08X405","Herbert H. Lehman High School","412","436","393","High School","5%",66.8,9.2,6.8,23,60.6,9,61.1,38.9,20.9,3593,"415"
"148","08X432","Bronx Bridges High School","s","s","s","High School","58%",87.2,79.4,5.2,8.4,83.2,2.6,52.3,47.7,7.7,155,"s"
"149","08X452","Bronx Guild","369","371","365","High School","44%",69.2,7.2,3.9,33.8,61.3,0.7,49.5,50.5,23,305,"39"
"151","08X519","Felisa Rincon De Gautier Institute For Law And Pub","373","370","356","High School","25%",72.3,14,1.4,21.8,76,0.6,43,57,20.9,363,"68"
"152","08X530","Banana Kelly High School","373","381","377","High School","42%",81.9,13.5,0.7,32.6,65.4,1.1,49.9,50.1,25.7,451,"54"
"153","08X537","Bronx Arena High School","s","s","s","Transfer High School","19%",60,4.7,2.3,40.3,55.8,0.8,43.4,56.6,6.2,129,"s"
"154","08X540","School For Community Research And Learning","366","400","368","High School","2%",83.8,11,4.7,28.8,64.9,1,57.1,42.9,28.3,191,"16"
"155","08X560","Bronx Academy High School","404","368","399","Transfer High School","7%",76.2,9.2,0,37.9,61,1,44.1,55.9,6.7,195,"9"
"156","08X650","Jane Addams High School For Academic Careers","377","359","376","High School","11%",85.7,11.2,1.5,36.8,60.8,0.3,28.3,71.7,22.2,717,"78"
"157","09X227","Bronx Expeditionary Learning High School","324","376","349","High School","41%",83.9,29.3,1.1,27.9,69.3,0.8,50.1,49.9,21.1,355,"39"
"158","09X231","Eagle Academy For Young Men","373","387","374","Middle/High School","41%",60.4,4,0.7,63.1,33.8,0.5,100,0,24.2,550,"78"
"159","09X239","Urban Assembly Academy For History And Citizenship","372","355","357","High School","21%",50.2,19.9,0.7,56.7,40.4,0.7,100,0,27.7,141,"33"
"160","09X241","Urban Assembly School For Applied Math And Science","411","464","415","Middle/High School","46%",79.5,9.4,2.6,32,63.4,1.5,49.3,50.7,14.7,606,"80"
"161","09X250","Eximius College Preparatory Academy: A College Boa","393","394","382","High School","34%",62.9,8.1,0.6,40.7,58.1,0.3,46.6,53.4,18.8,356,"50"
"162","09X252","Mott Hall Bronx High School","369","367","356","High School","19%",58.9,8.8,1.1,24.3,73.7,0.8,45.8,54,15.5,354,"67"
"163","09X260","Bronx Center For Science And Mathematics","459","480","457","High School","55%",70,1.6,5.9,24.3,68.7,1.1,46.2,53.8,14,444,"81"
"164","09X263","Validus Preparatory Academy: An Expeditionary Lear","356","363","356","High School","34%",76.1,12.1,1.1,34.2,63.8,0.3,44.1,55.9,16.2,365,"74"
"165","09X276","Leadership Institute","361","353","367","High School","49%",94.8,16.5,1.7,33,63.5,1.3,52.2,47.8,16.1,230,"30"
"166","09X297","Morris Academy For Collaborative Studies","386","386","376","High School","35%",79.1,19.1,0.4,26,73.1,0.4,53.8,46.2,22.4,450,"38"
"167","09X324","Bronx Early College Academy For Teaching & Learnin","s","s","s","Middle/High School","25%",79.4,11,3,32,64.5,0.2,48.5,51.5,16.2,493,"s"
"168","09X329","Dreamyard Preparatory School","382","365","391","High School","20%",80,24.4,0,26.9,69.9,0.3,44.1,55.9,19.5,349,"51"
"169","09X365","Academy For Language And Technology","315","339","297","High School","85%",85.7,86.6,0,0.6,99.4,0,48.8,51.2,0.9,336,"54"
"170","09X403","Bronx International High School","314","312","339","High School","49%",82.3,87.1,1,22.8,72.2,3.7,45.7,54.3,1.2,403,"49"
"171","09X404","School For Excellence","363","360","351","High School","82%",81.4,20.7,0.3,34.5,64.5,0,52.3,47.7,26.2,386,"32"
"172","09X412","Bronx High School Of Business","356","376","351","High School","27%",77.6,23.2,0.7,38.7,59.9,0.5,54.9,45.1,23.2,401,"34"
"173","09X413","Bronx High School For Medical Science","400","419","402","Middle/High School","33%",76.9,5.7,5.3,36.7,57.8,0.2,42.2,57.8,8.6,455,"64"
"174","09X414","Jonathan Levin High School For Media And Communica","379","364","379","High School","12%",77.7,38.5,0.5,22.3,75.4,1.6,53.4,46.6,20.9,382,"35"
"175","09X505","Bronx School For Law, Government And Justice","404","418","402","Middle/High School","58%",66.2,6.6,2,30.4,66.2,1,45.9,54.1,14,763,"80"
"176","09X517","Frederick Douglass Academy Iii Secondary School","368","384","369","Middle/High School","83%",79.7,6.4,1.1,56.2,41.4,0.4,51.5,48.5,17.7,532,"50"
"177","09X525","Bronx Leadership Academy High School","384","394","388","High School","16%",76.9,9.6,0.7,41.1,57,0,43.3,56.7,20.3,705,"114"
"178","09X543","High School For Violin And Dance","353","315","371","High School","42%",84.3,8.7,0.3,36.8,62.5,0,14.6,85.4,22.3,323,"27"
"179","10X141","Riverdale / Kingsbridge Academy (Middle School / H","438","455","440","Middle/High School","22%",39.7,6.7,8.8,13,53,24.9,51.8,48.2,15.2,1337,"113"
"180","10X213","Bronx Engineering And Technology Academy","373","412","365","High School","26%",79.8,15.5,5.2,29.5,64.2,0.9,82.7,17.3,21.4,444,"86"
"181","10X225","Theatre Arts Production Company School","405","391","394","Middle/High School","19%",67.4,4.4,1.1,27.3,69.7,1.1,30.9,69.1,18.9,524,"59"
"182","10X237","The Marie Curie School For Medicine, Nursing, And","382","393","382","High School","30%",71.5,6.7,1.5,35.6,57.4,3.3,16.5,83.5,15.6,540,"79"
"183","10X243","West Bronx Academy For The Future","382","406","370","Middle/High School","43%",86.3,13.2,3.5,24.7,69.5,1.3,57.9,42.1,19.5,636,"26"
"184","10X268","Kingsbridge International High School","304","356","302","High School","58%",95.1,88.7,6.8,5.4,84.7,3,52.3,47.7,0.4,497,"52"
"185","10X284","Bronx School Of Law And Finance","402","395","385","High School","22%",74.2,7.1,0.7,31.5,65.2,2.6,56.6,43.4,15.2,422,"54"
