"186","10X319","Providing Urban Learners Success In Education High","s","s","s","Transfer High School","1%",81.8,5.2,0,37.6,61.5,0.5,40.4,59.6,16.4,213,"s"
"187","10X342","International School For Liberal Arts","300","333","301","Middle/High School","71%",78.3,79.9,0.2,0,99.8,0,49,51,4.6,606,"49"
"188","10X368","In-Tech Academy (M.S. / High School 368)","390","408","383","Middle/High School","37%",77.9,12.1,4,11.9,81.9,2,48.9,51.1,14.3,1126,"111"
"189","10X374","Knowledge And Power Preparatory Academy Internatio","392","401","387","High School","72%",75.3,9.3,0.9,35.2,59.9,3.1,47.2,52.8,11.1,324,"61"
"190","10X397","English Language Learners And International Suppor","343","356","330","High School","22%",92.8,80.4,7,16.5,72.5,1.9,55.7,44.3,0,316,"38"
"191","10X433","High School For Teaching And The Professions","370","371","365","High School","25%",88.1,17.8,2.5,25.2,70.4,1.9,42.3,57.7,20.1,473,"57"
"192","10X434","Belmont Preparatory High School","404","418","400","High School","28%",76.8,11.3,3.2,29,65.6,1.7,47.2,52.8,15.7,407,"51"
"193","10X437","Fordham High School For The Arts","355","350","372","High School","30%",78.3,12.4,1.6,35.7,61.5,1.3,43.2,56.8,22.5,387,"48"
"194","10X438","Fordham Leadership Academy For Business And Techno","367","385","367","High School","23%",78.9,16.6,2.7,27.7,67.8,1.3,63.4,36.6,20.6,451,"63"
"195","10X439","Bronx High School For Law And Community Service","366","364","352","High School","27%",80.2,13.4,2.3,30.8,64.6,0.9,44.4,55.6,20.8,432,"65"
"196","10X440","Dewitt Clinton High School","419","426","410","High School","17%",74.8,19,6.7,30.8,59.6,2.1,51.1,48.9,14.9,4159,"443"
"197","10X442","Celia Cruz Bronx High School Of Music, The","423","420","427","High School","35%",74.7,3.5,0.5,27.2,69.5,2.4,40.7,59.3,7.8,423,"52"
"198","10X445","Bronx High School Of Science","632","688","649","High School","41%",34.2,0.1,63.5,3.5,7.2,25.4,57.8,42.2,0.1,3013,"731"
"199","10X475","John F. Kennedy High School","351","362","339","High School","16%",77.8,23.8,0.7,35.1,62.7,1.4,68.3,31.7,20.8,706,"109"
"200","10X477","Marble Hill High School For International Studies","414","435","414","High School","57%",83.9,32.2,11,23,57.9,7.5,46.7,53.3,6.8,456,"99"
"201","10X546","Bronx Theatre High School","348","362","354","High School","89%",73.7,9.4,0.4,28.8,69,1.8,32.1,67.9,15.1,445,"68"
"202","10X549","Discovery High School","372","379","364","High School","5%",80,20.6,2.1,20.2,75.6,1.3,52.4,47.6,17.8,529,"55"
"203","10X660","Grace Dodge Career And Technical Education High Sc","362","382","356","High School","14%",71,18.8,1.5,30.1,67.1,0.9,40,60,24.1,1162,"73"
"205","10X696","High School Of American Studies At Lehman College","636","648","636","High School","31%",20.8,0,16.7,10.6,18,53.8,53.8,46.2,1.3,377,"92"
"206","11X249","Bronx Health Sciences High School","370","381","382","High School","11%",73.9,6.1,4.8,56.8,36.3,0.5,35.3,64.7,7.4,377,"74"
"207","11X253","Bronx High School For Writing And Communication Ar","400","357","390","High School","24%",72.4,8.5,2.4,48.3,47.6,1.7,40.8,59.2,14.5,422,"46"
"208","11X265","Bronx Lab School","377","391","367","High School","43%",75.5,3.7,2.7,37.8,57.3,1.7,59.5,40.5,15.8,482,"81"
"209","11X270","Academy For Scholarship And Entrepreneurship: A Co","386","394","361","Middle/High School","33%",63.7,6.3,2.5,63.7,32,0.7,52,48,18.5,606,"56"
"210","11X275","High School Of Computers And Technology","381","376","354","High School","43%",71.8,10.2,3.6,34.9,59.5,1.3,87.3,12.7,20.2,550,"72"
"211","11X288","Collegiate Institute For Math And Science","444","471","433","High School","55%",67.9,3.3,9.2,36.8,46.8,7,57.1,42.9,14,543,"97"
"212","11X290","Bronx Academy Of Health Careers","387","365","383","High School","26%",70.8,7.7,3.3,52.6,41.2,1,32.7,67.3,19,483,"69"
"213","11X299","Astor Collegiate Academy","387","391","391","High School","22%",64.4,7.6,5.4,35.7,46,11.8,58.6,41.4,21.7,498,"60"
"214","11X415","Christopher Columbus High School","367","361","353","High School","20%",59.2,18.3,5.8,34.9,46.5,12.7,55.2,44.8,24.1,727,"121"
"216","11X418","Bronx High School For The Visual Arts","419","433","416","High School","28%",68.7,5.2,1.9,29.2,62.3,6.4,58,42,20.9,483,"48"
"217","11X455","Harry S Truman High School","386","397","368","High School","5%",50.6,9.2,2,51.8,43.8,1.3,60,40,25.1,1773,"189"
"218","11X513","New World High School","332","381","335","High School","29%",79.5,80.1,12.4,13.2,70.4,3.2,50,50,1.5,402,"72"
"219","11X514","The Bronxwood Preparatory Academy","377","372","363","High School","25%",66.7,7,1.9,58.2,37.3,1,61.3,38.7,20.9,416,"48"
"220","11X541","Global Enterprise High School","372","382","375","High School","18%",80.3,14.4,4.1,35.9,54.1,5.6,56.7,43.3,17.8,270,"57"
"221","11X542","Pelham Preparatory Academy","431","438","419","High School","68%",61,2.2,2.4,40.2,49.7,6.9,48.1,51.9,14.2,507,"76"
"222","11X544","High School For Contemporary Arts","383","378","365","High School","80%",71.9,10.2,1,37.2,59.9,1,55.3,44.7,21.3,479,"55"
"223","11X545","Bronx Aerospace High School","388","393","382","High School","31%",45.6,14.7,2.2,23.8,72.6,1.2,82.5,17.5,25.7,416,"46"
"224","12X245","New Day Academy","348","344","354","Middle/High School","11%",87,11,1,45.5,53.4,0,48.2,51.8,23,191,"25"
"225","12X248","Metropolitan High School, The","347","367","341","High School","16%",86.6,21.8,1.8,24.2,72.9,0.9,54,46,20.9,339,"49"
"226","12X251","Explorations Academy","381","381","360","High School","27%",76.4,19.9,1.7,31.2,65.5,1.4,50.8,49.2,21.3,362,"57"
"227","12X262","Performance Conservatory High School","361","353","360","High School","14%",61.9,10,1.2,39.2,57.7,0.8,24.6,75.4,28.1,260,"30"
"228","12X267","Bronx Latin","408","432","411","Middle/High School","74%",79.3,13.6,0.2,25.6,73.2,1,49.8,50.2,21.5,418,"36"
"229","12X271","East Bronx Academy For The Future","366","378","358","Middle/High School","26%",86.2,11.6,1.9,29.4,68.3,0.2,53,47,24.1,619,"46"
"230","12X278","Peace And Diversity Academy","390","401","364","High School","91%",78.8,13.9,1.7,43.7,53.7,0.9,45,55,17.3,231,"34"
"231","12X388","Pan American International High School At Monroe","321","351","298","High School","49%",100,92.9,0,0,99.8,0,51.5,48.5,0.2,406,"30"
"233","12X446","Arturo A. Schomburg Satellite Academy Bronx","380","372","349","Transfer High School","79%",62.1,4.8,0.4,41.2,57,0,33.3,66.7,9.2,228,"14"
"234","12X478","The Cinema School","s","s","s","High School","22%",75.9,4,4.5,28.7,65,1.8,40.8,59.2,4,223,"s"
"235","12X479","Bronx Career And College Preparatory High School","s","s","s","High School","48%",72.2,16.8,2.5,37.3,59.8,0.4,44.3,55.7,27.5,244,"s"
"236","12X480","Bronx Regional High School","398","385","398","Transfer High School","13%",73,10.1,1.5,40.5,57.1,0.6,37.6,62.4,8,338,"16"
"237","12X550","High School Of World Cultures","304","323","312","High School","100%",90.6,86.4,2.4,10.8,84.6,0.5,52,48,0.5,369,"42"
"238","12X682","Fannie Lou Hamer Freedom High School","342","346","341","High School","46%",81.1,11.5,0.2,30.6,68.8,0.2,54.1,45.9,26.2,477,"72"
"239","12X684","Wings Academy","378","374","362","High School","59%",66.4,4.5,1.3,55,42.2,1.3,53.7,46.3,22.3,538,"66"
"240","12X690","Monroe Academy For Business/Law","375","387","376","High School","36%",80.8,14.9,2.4,26.9,69.1,0.4,60.6,39.4,18.5,249,"31"
"241","12X692","Monroe Academy For Visual Arts & Design","332","357","349","High School","9%",87.3,28.8,0.9,20.4,77.5,1.3,52.6,47.4,20.8,466,"43"
"242","13K265","Dr. Susan S. Mckinney Secondary School Of The Arts","352","349","373","Middle/High School","35%",71.1,4.3,0.5,72,24.6,1.8,37,63,20.3,443,"29"
"243","13K336","Academy Of Business And Community Development","439","374","418","Middle/High School","32%",59.1,3.1,2.7,88.9,7.1,0.4,99.6,0.4,21.3,225,"9"
"244","13K350","Urban Assembly High School Of Music And Art","360","364","356","High School","13%",74.1,4.6,1.9,73.3,22.7,0.9,42.7,57.3,22.5,431,"52"
"245","13K412","Brooklyn Community High School Of Communication, A","375","355","384","High School","14%",68.9,2.4,0.6,79.2,17.1,1.3,45.5,54.5,18,462,"37"
"246","13K419","Science Skills Center High School For Science, Tec","399","417","395","High School","33%",60.7,7,7.2,77.8,12.2,2.1,56.1,43.9,13.7,517,"92"
"247","13K430","Brooklyn Technical High School","587","659","587","High School","6%",50.7,0.1,60.3,10.2,7.9,21.3,58.3,41.7,0.5,5332,"1277"
"248","13K439","Brooklyn International High School","305","364","312","High School","85%",80,83.1,42.5,20.2,28.6,8.7,48.2,51.8,0,367,"90"
"249","13K483","The Urban Assembly School For Law And Justice","400","417","389","High School","38%",60.5,0.9,0.9,79.1,17.1,1.1,39.6,60.4,13.3,450,"105"
"250","13K499","Acorn Community High School","384","364","368","High School","12%",81,2.9,1.2,84.7,12.2,0.8,55.8,44.2,18.6,731,"72"
"251","13K509","Freedom Academy High School","400","390","403","High School","24%",68,1.8,1.4,82.1,15.1,0.9,43.6,56.4,14.2,218,"29"
"252","13K527","Urban Assembly Institute Of Math And Science For Y","s","s","s","Middle/High School","45%",62.2,1.5,5.1,79.3,11.7,2.6,0,100,13.2,469,"s"
"253","13K553","Brooklyn Academy High School","435","383","379","Transfer High School","34%",67.2,0,0.5,86.4,11.4,0,49.5,50.5,9.8,184,"8"
"254","13K575","Bedford Stuyvesant Preparatory High School","398","391","394","Transfer High School","26%",74.6,0.7,0,83.6,12.5,2,35.5,64.5,0,152,"13"
"255","13K595","Bedford Academy High School","438","443","431","High School","53%",46.7,1.1,2.7,89.4,7.1,0.3,49,51,4.1,367,"89"
"256","13K605","George Westinghouse Career And Technical Education","406","391","392","High School","41%",65,1.9,2.8,79.8,15.3,1.3,75.5,24.5,14.1,927,"85"
"257","13K616","Brooklyn High School For Leadership And Community","s","s","s","Transfer High School","21%",63.9,2.4,0.5,68.4,28.3,1.4,49.5,50.5,7.5,212,"s"
"258","13K670","Benjamin Banneker Academy","471","472","448","High School","17%",47.4,0,2.7,87,8.8,0.4,46.1,53.9,3,895,"185"
"259","13K674","City Polytechnic High School Of Engineering, Archi","441","499","413","High School","25%",61.9,3.6,7.5,58.2,26.3,4.5,79.4,20.6,15.8,335,"20"
"260","14K071","Juan Morel Campos Secondary School","365","361","359","Middle/High School","16%",76.6,24.9,0.2,15.3,80.6,3.4,54.7,45.3,26.7,865,"102"
"261","14K322","Foundations Academy","s","s","s","High School","23%",78.7,5.7,1.4,66.7,29.8,1.4,56.7,43.3,28.4,141,"s"
"262","14K404","Academy For Young Writers","387","357","381","High School","16%",65.3,2.5,0.7,63.5,32.2,3,24.2,75.7,12.7,400,"68"
"263","14K449","Brooklyn Latin School, The","586","584","570","High School","29%",53.3,0.4,36.8,26.7,17.9,14.5,54.9,45.1,1.1,468,"72"
"264","14K454","Green School: An Academy For Environmental Careers","407","386","396","High School","23%",72.9,11.5,2,47.7,46.9,2.6,46.2,53.8,15.3,392,"41"
"265","14K474","Progress High School For Professional Careers","364","379","371","High School","24%",84.8,16.1,0.7,32.6,65.4,1,48.5,51.5,13,1068,"144"
"266","14K477","School For Legal Studies","413","396","395","High School","22%",65.6,5.7,0.9,57.7,39.3,1.7,45.8,54.2,13,759,"134"
"267","14K478","The High School For Enterprise, Business And Techn","398","421","396","High School","26%",74.2,9.9,3.2,39.3,55.4,1.9,65.7,34.3,13.2,976,"142"
"268","14K488","Brooklyn Preparatory High School","367","373","350","High School","27%",80.3,2.7,1.7,58.7,37.7,1,47.7,52.2,18.8,400,"42"
"269","14K558","Williamsburg High School For Architecture And Desi","363","385","364","High School","69%",82.6,7,1.4,38.4,57.2,2.2,72.6,27.4,17.6,500,"72"
"270","14K561","Williamsburg Preparatory School","397","410","380","High School","30%",81,2.8,1.6,25.5,61.5,11.1,51,49,12.7,577,"113"
"271","14K586","Lyons Community School","371","377","355","Middle/High School","28%",78.6,14.6,1.1,41.7,54.6,2.1,53.7,46.3,22,527,"31"
"272","14K610","Automotive High School","367","376","350","High School","6%",67.1,4.7,1.4,66.1,30.2,1.7,95.6,4.4,30.3,723,"94"
"273","14K632","Frances Perkins Academy","382","372","368","High School","13%",86.9,9.8,0,64.7,31.2,4,76.9,23.1,24.9,173,"12"
"274","14K685","El Puente Academy For Peace And Justice","359","335","341","High School","63%",80.4,17,1.8,10.1,87.6,0.5,42.7,57.3,23.4,218,"28"
"276","15K429","Brooklyn School For Global Studies","361","367","383","Middle/High School","17%",68.2,5.9,2.3,54.5,39,3.4,56.2,43.8,25.4,354,"52"
"277","15K448","Brooklyn Secondary School For Collaborative Studies","393","399","387","Middle/High School","33%",57.2,4.5,4.3,34.2,48.1,12.6,59.1,40.9,29.2,692,"76"
"278","15K462","Secondary School For Law","398","411","394","Middle/High School","51%",76.1,6.3,2.5,62.4,29.6,5.5,44.2,55.8,12.7,473,"59"
"279","15K463","Secondary School For Journalism","397","391","381","Middle/High School","35%",77,16.7,9.2,42,43.2,5.4,42.3,57.7,13.4,336,"58"
"280","15K464","Park Slope Collegiate","379","416","380","Middle/High School","12%",78,9.6,8.6,33.2,51.8,5.3,52.8,47.2,16.5,394,"72"
"281","15K497","School For International Studies","405","415","392","Middle/High School","30%",68.1,14.6,6.2,40.9,38.9,14,50.8,49.2,15.2,486,"64"
"282","15K519","Cobble Hill School Of American Studies","398","402","385","High School","33%",73.4,7.5,5.1,71.5,21,2.3,43.9,56.1,18.9,663,"77"
"283","15K520","Pacific High School","352","341","300","Transfer High School","7%",58,0,0,82,18,0,61,39,8,100,"9"
"284","15K529","West Brooklyn Community High School","s","s","s","Transfer High School","83%",71.2,2.3,8.9,9.4,64.8,16.9,58.7,41.3,7.5,213,"s"
"285","15K530","Metropolitan Corporate Academy High School","368","365","368","High School","22%",68.2,1.1,0.5,80.6,16.7,0,50,50,17.2,186,"28"
"286","15K656","Brooklyn High School Of The Arts","426","421","411","High School","17%",59.3,0.1,1.8,76.5,19,2.2,33.9,66.1,7.2,678,"141"
"287","15K667","Sunset Park High School","s","s","s","High School","34%",79.9,14.4,4.7,7.8,80.8,6.7,50.7,49.3,22.3,988,"s"
"288","15K698","South Brooklyn Community High School","430","416","425","Transfer High School","10%",74,2,0.7,21.5,72.5,4,45,55,6,149,"8"
"289","16K393","Frederick Douglass Academy Iv Secondary School","355","355","358","Middle/High School","37%",71,1.4,0.9,83.6,14.1,0.5,48.7,51.3,17.1,439,"20"
"290","16K455","Boys And Girls High School","365","370","362","High School","15%",61.7,2.5,0.5,90,7.8,0.7,61.7,38.3,20.5,1631,"131"
"291","16K498","Brooklyn High School For Law And Technology","362","372","358","High School","17%",74.5,4.7,1,72.8,24.9,0,51.6,48.4,20.7,405,"46"
"292","16K594","Gotham Professional Arts Academy","370","372","351","High School","12%",58.6,2.4,1,78.6,19.4,0.7,43.2,56.8,17.3,294,"36"
"293","16K688","The Brooklyn Academy Of Global Finance","s","s","s","High School","15%",57.4,6.3,1.9,74.2,20.8,2.5,51.6,48.4,20.8,159,"s"
"294","17K382","Academy For College Preparation And Career Explora","396","374","369","Middle/High School","13%",57,5,0.2,92,6.7,1.1,53.8,46.2,10.8,565,"59"
"295","17K408","Academy Of Hospitality And Tourism","352","342","351","High School","59%",65.5,12.9,1.6,84.3,12.9,0.9,49.8,50.2,15.4,319,"57"
"297","17K489","W.E.B. Dubois Academic High School","394","364","334","Transfer High School","25%",70.3,0.5,1,93.5,4,0.5,45.7,54.3,11.1,199,"7"
"298","17K524","International High School At Prospect Heights","287","335","291","High School","37%",80.9,91,28.4,29.2,27.9,14.2,59.1,40.9,1,401,"71"
"299","17K528","The High School For Global Citizenship","403","385","388","High School","25%",68.7,5.2,1.5,89.2,7.3,1.5,50.1,49.9,13.4,343,"46"
"300","17K531","School For Human Rights, The","348","381","359","Middle/High School","47%",73.2,6.2,0.8,88.9,8.3,1.6,51.6,48.4,15,386,"35"
"301","17K533","School For Democracy And Leadership","377","404","372","Middle/High School","48%",68.3,3.7,0.5,89.4,8.4,1.5,52,48,14.5,406,"38"
"302","17K537","High School For Youth And Community Development At","338","349","340","High School","57%",60.9,9.1,1,87.3,9.1,1,61.6,38.4,15.8,385,"73"
"303","17K539","High School For Service & Learning At Erasmus","362","375","368","High School","41%",65.3,8.8,2.1,87,9,1.7,63.3,36.7,19.2,422,"61"
"304","17K543","Science, Technology And Research Early College Hig","457","462","441","Middle/High School","95%",63.3,0,3.1,83.9,9.4,1.3,53,47,2.3,521,"69"
"305","17K544","International Arts Business School","386","391","369","High School","12%",69.3,7.9,0.8,86.9,10,1.3,47.9,52.1,17.4,390,"54"
"306","17K546","High School For Public Service: Heroes Of Tomorrow","418","441","414","High School","28%",70.3,0.5,3.6,82.5,12.2,0.7,24.9,75.1,4.1,417,"79"
"307","17K547","Brooklyn Academy Of Science And The Environment","388","382","373","High School","24%",80.9,6.8,4,79.6,14.2,1.5,54.4,45.6,11.9,471,"63"
"308","17K548","Brooklyn School For Music & Theatre","385","393","373","High School","45%",60.5,0.5,1,82.8,15.3,1,32.8,67.2,12.1,412,"48"
"309","17K568","Brownsville Academy High School","372","356","335","Transfer High School","47%",71.7,3.1,1.3,84.3,9.9,1.3,37.7,62.3,8.5,223,"16"
"310","17K590","Medgar Evers College Preparatory School","476","481","479","Middle/High School","38%",59.1,0,0.9,95.7,2.8,0,41.8,58.2,0.5,1104,"165"
"311","17K600","Clara Barton High School","425","413","413","High School","26%",73,8.3,1.8,91.2,5.8,0.7,23.8,76.2,12.7,1608,"259"
"312","17K625","Paul Robeson High School","365","363","355","High School","11%",77.9,3.4,0.9,87.1,9.5,1.5,54.9,45.1,25.5,326,"53"
"313","17K751","Academy For Health Careers","s","s","s","High School","28%",87.7,8,3.6,81.2,13.8,1.4,27.5,72.5,15.2,138,"s"
"314","18K563","It Takes A Village Academy","313","320","330","High School","46%",76.5,30.4,1.8,92.9,4.5,0.5,49,51,11.5,382,"56"
"315","18K566","Brooklyn Generation School","374","377","394","High School","16%",60.5,5.7,1.5,88.8,8.5,0.9,61,39,19.6,331,"29"
"316","18K567","Brooklyn Theatre Arts High School","383","358","377","High School","12%",67.8,5,0.5,84.3,12.8,2.1,36.1,63.9,18.6,382,"54"
"317","18K569","Kurt Hahn Expeditionary Learning School","368","378","346","High School","38%",62.6,9.5,0,88.1,8.8,1.7,64.3,35.7,20.1,294,"43"
"318","18K576","Victory Collegiate High School","387","377","379","High School","31%",64.1,5.2,0.3,93.5,5.8,0,48.9,51.1,16.6,325,"63"
"319","18K578","Brooklyn Bridge Academy","384","362","351","Transfer High School","87%",65,2.8,0.9,88,9.2,0.9,58.5,41.5,11.1,217,"17"
"320","18K589","Arts & Media Preparatory Academy","361","360","359","High School","30%",54.4,3.4,0.7,89.4,9.6,0,47.4,52.6,17.4,293,"48"
"321","18K617","High School For Innovation In Advertising And Medi","404","393","386","High School","38%",61.3,8.1,1.3,85.8,10.6,1.3,66.5,33.5,18.1,310,"37"
"322","18K629","Cultural Academy For The Arts And Sciences","393","395","381","High School","14%",71.6,7.7,1.3,86.6,11.4,0.7,51.5,48.5,18.4,299,"33"
"323","18K633","High School For Medical Professions","386","380","393","High School","64%",75.2,3.3,1.7,85,12.4,0.2,21.5,78.5,10.4,460,"75"
"324","18K635","Olympus Academy","400","370","370","Transfer High School","2%",51.1,1.5,1,86.2,11.3,1,50.2,49.8,9.4,203,"7"
"325","18K637","Academy For Conservation And The Environment","363","381","367","High School","41%",54.5,6.9,2.2,83.9,12,1.5,54.7,45.3,16.8,274,"35"
"326","18K642","Urban Action Academy","376","385","374","High School","21%",76.4,11.1,2.3,82.3,10.5,3.9,62.6,37.4,12.5,305,"40"
"327","18K673","East Brooklyn Community High School","410","403","378","Transfer High School","29%",56.7,0.5,1,88.7,9.4,0.5,52.2,47.8,8.9,203,"12"
"328","19K409","East New York Family Academy","416","432","394","Middle/High School","41%",72.2,0.5,0.5,67.2,30.3,1.4,43.2,56.8,2.1,433,"54"
"329","19K420","Franklin K. Lane High School","s","s","s","High School","54%",64.3,38.4,4.5,11.6,82.1,1.8,51.8,48.2,12.5,112,"s"
"331","19K502","Fdny High School For Fire And Life Safety","341","349","333","High School","42%",70.9,5,1,73.8,23.4,1.6,81.1,18.9,21,381,"37"
"332","19K504","High School For Civil Rights","363","349","342","High School","18%",60.5,9.7,2,74.3,22.2,1,54.4,45.6,16.2,401,"47"
"333","19K507","Performing Arts And Technology High School","380","386","383","High School","18%",76,4.9,0.7,81.5,17.4,0,51.4,48.6,19.6,453,"61"
"334","19K510","World Academy For Total Community Health High Scho","371","365","370","High School","29%",72.6,4.2,2.1,81.1,14.2,1.3,36.8,63.2,14.7,380,"68"
"335","19K583","Multicultural High School","279","322","286","High School","12%",73.4,94.6,0,0.2,99.8,0,49.8,50.2,1,406,"29"
"336","19K615","Transit Tech Career And Technical Education High S","395","418","380","High School","11%",62.3,2.4,4.4,70.5,23.2,1.5,84.1,15.9,14.2,1317,"182"
"337","19K618","Academy Of Innovative Technology","371","371","354","High School","28%",75.8,12.1,7.4,38.4,50.2,3,70.3,29.7,19.3,404,"60"
"338","19K639","Brooklyn Lab School","360","385","363","High School","25%",76,15.4,1.5,30.7,65,1.3,58.4,41.6,19.4,397,"57"
"339","19K659","Cypress Hills Collegiate Preparatory School","376","385","368","High School","42%",67.1,16.2,8.2,16.9,73.2,1.4,47.8,52.2,11.7,437,"51"
"340","19K660","W. H. Maxwell Career And Technical Education High","370","369","363","High School","66%",73.3,5.3,0.5,71.9,25.4,0.7,29.8,70.2,26.6,590,"74"
"341","19K683","The School For Classics: An Academy Of Thinkers, W","383","400","374","High School","51%",81.9,9,10,54.3,34.7,0.6,37.6,62.4,17.7,311,"38"
"342","20K445","New Utrecht High School","402","471","399","High School","52%",59,23,35.9,5.5,28,30.5,59.3,40.7,15.6,3276,"456"
"343","20K485","High School Of Telecommunication Arts And Technolo","425","474","424","High School","16%",67.3,4.9,19.2,9.5,54.1,16.8,53.5,46.5,19.4,1280,"238"
"344","20K490","Fort Hamilton High School","417","478","411","High School","58%",45.9,21.2,30.3,5,30.2,34.2,53.4,46.6,12.8,4275,"694"
"345","20K505","Franklin Delano Roosevelt High School","383","486","375","High School","46%",74.3,39.4,44.2,9.4,27.3,18.6,58.4,41.6,10.8,3108,"385"
"346","20K609","Urban Assembly School For Criminal Justice","s","s","s","Middle/High School","20%",82.7,15.5,35,33.7,21.9,9.1,0,100,17.1,374,"s"
"348","21K337","International High School At Lafayette","326","386","314","High School","63%",73.8,89.2,42,14,21,22.7,58.9,41.1,0.3,343,"54"
"349","21K344","Rachel Carson High School For Coastal Studies","402","427","408","High School","41%",70.4,11,12.3,24.1,25.8,37.6,53.6,46.4,16,481,"54"
"350","21K348","High School Of Sports Management","388","398","378","High School","22%",69.2,2.4,2.7,68.4,23,5.9,88.9,11.1,14.6,370,"39"
"351","21K410","Abraham Lincoln High School","396","437","393","High School","12%",53.3,16.7,19.3,35.1,20.1,25.1,56.4,43.6,11.5,2595,"475"
"352","21K468","Kingsborough Early College School","s","s","s","Middle/High School","58%",70,2.8,7.2,25,22.7,44.7,57.8,42.2,15.7,472,"s"
"353","21K525","Edward R. Murrow High School","468","496","467","High School","24%",28.5,9.1,27.1,24.1,17.6,30.8,42.4,57.6,14.1,4022,"727"
"354","21K540","John Dewey High School","404","468","390","High School","32%",58.7,19.6,39.1,30.6,19.1,10.8,51.5,48.5,8.7,2168,"448"
"355","21K559","Life Academy High School For Film And Music","384","375","365","High School","37%",72,4.8,4.8,44.6,29.9,20.3,51,49,20.3,251,"40"
"356","21K572","Expeditionary Learning School For Community Leader","353","370","356","High School","33%",64.4,21.7,19.5,19.5,41.2,19.5,51.3,48.7,16.4,226,"40"
"357","21K620","William E. Grady Career And Technical Education Hi","394","414","376","High School","53%",74.3,3.1,3.2,74.9,14,6.9,78,22,22.7,956,"95"
"358","21K690","Brooklyn Studio Secondary School","429","449","435","Middle/High School","30%",49.9,8.4,12.8,7.2,23.1,56.5,50.1,49.9,18.7,876,"119"
"359","21K728","Liberation Diploma Plus","411","369","373","Transfer High School","69%",82.3,1.6,2.6,44,37.7,15.2,41.9,58.1,6.3,191,"10"
"360","22K405","Midwood High School","478","519","476","High School","17%",41.2,3.7,31.7,35.2,11.7,21.2,45.3,54.7,5.2,3842,"824"
"361","22K425","James Madison High School","436","475","439","High School","26%",58.3,13.2,20.8,17.9,14.5,46.4,54.4,45.6,12.4,3076,"518"
"362","22K495","Sheepshead Bay High School","383","392","370","High School","11%",53.1,21.7,12,61.8,15.8,10.1,53.2,46.8,13.1,1928,"236"
"363","22K535","Leon M. Goldstein High School For The Sciences","524","561","542","High School","27%",29,0.5,13.5,9.4,10.8,65.6,41.2,58.8,7.3,1022,"259"
"364","22K555","Brooklyn College Academy","456","456","440","Middle/High School","72%",48.4,0.2,5.9,77.9,12.4,2.7,36.3,63.7,1.7,630,"131"
"365","23K493","Brooklyn Collegiate: A College Board School","389","409","387","Middle/High School","19%",74.5,1.6,1.9,88.1,8.3,0.5,50.7,49.3,12.1,580,"60"
"366","23K514","Frederick Douglass Academy Vii High School","361","371","359","High School","45%",66.9,1.4,0.8,88.5,10.4,0,48.5,51.5,20.3,365,"55"
"367","23K643","Brooklyn Democracy Academy","349","338","331","Transfer High School","2%",62.3,2.4,1.5,85.9,11.7,0.5,47.8,52.2,16.1,205,"11"
"368","23K646","Aspirations Diploma Plus High School","311","371","311","Transfer High School","23%",72.5,2.2,1.5,77.8,20,0.4,46.2,53.8,7.3,275,"7"
"369","23K647","Metropolitan Diploma Plus High School","350","346","332","Transfer High School","35%",72.1,1.1,0,86.2,13.8,0,48.6,51.4,8.8,181,"17"
"370","23K697","Teachers Preparatory High School","392","416","388","Middle/High School","47%",69.8,1.8,0.7,84.8,13.1,1.2,34.1,65.9,11,566,"69"
"371","24Q264","Academy Of Finance And Enterprise","405","454","421","High School","76%",62.8,7.9,17.9,9.8,56.4,15.2,49.3,50.7,9.8,420,"89"
"372","24Q267","High School Of Applied Communication","406","413","400","High School","16%",66.9,10.3,13.9,12.9,57.2,16,43.8,56.2,16.2,388,"39"
"373","24Q293","Civic Leadership Academy","404","429","407","High School","48%",71,9.1,7.8,9.1,79.3,3.3,44.5,55.5,18.5,449,"69"
"374","24Q296","Pan American International High School","317","323","311","High School","48%",78.3,91.3,0,0,100,0,47.8,52.2,0.8,366,"55"
"375","24Q299","Bard High School Early College Ii","545","568","550","High School","49%",39.2,0.3,32,16.2,21.2,30.3,39.3,60.7,0,631,"155"
