"376","24Q455","Newtown High School","383","440","380","High School","19%",56.2,30,24.6,9.3,60.3,5.3,57.5,42.5,10.3,2572,"320"
"378","24Q485","Grover Cleveland High School","395","420","396","High School","17%",41.4,21.6,9.1,4.4,63.5,22.7,55,45,12.7,2069,"241"
"379","24Q520","Middle College High School At Laguardia Community","399","393","385","High School","26%",58.9,0.2,7.8,9.5,71.4,11.3,52.9,47.1,13.1,497,"58"
"380","24Q530","International High School At Laguardia Community C","326","409","329","High School","74%",75.7,76.5,43,2,44,10.3,46,54,0,493,"69"
"381","24Q550","High School For Arts And Business","391","403","380","High School","26%",69.6,13.3,9.1,8.3,79.2,3,43.1,56.9,12.2,828,"138"
"382","24Q560","Robert F. Wagner, Jr. Secondary School For Arts An","443","447","440","Middle/High School","21%",60.5,3.8,20.8,6.2,62.4,10.5,46.6,53.4,12.3,601,"80"
"383","24Q600","Queens Vocational And Technical High School","417","447","406","High School","17%",71.9,6.4,10.2,6.9,74.2,8.7,60.3,39.7,13.7,1368,"155"
"384","24Q610","Aviation Career & Technical Education High School","445","496","423","High School","19%",61.2,3.2,27.1,6.8,55.3,10.1,85.3,14.7,5.3,2201,"396"
"385","24Q744","Voyages Preparatory","s","s","s","Transfer High School","86%",59.1,3.6,8.1,23,61.7,6.9,50.4,49.6,6,248,"s"
"386","25Q252","Queens School Of Inquiry, The","455","498","443","Middle/High School","41%",41.3,2.7,40.2,17,24.2,18.1,46.7,53.3,11.8,587,"58"
"387","25Q263","Flushing International High School","314","417","318","High School","79%",84.1,88.6,64.5,1.2,32.7,1.7,57.3,42.7,0.7,422,"45"
"388","25Q281","East-West School Of International Studies","416","463","392","Middle/High School","40%",53.3,13.6,62.7,14.8,17.9,3.4,54.1,45.9,9.4,616,"59"
"389","25Q285","World Journalism Preparatory: A College Board Scho","471","489","481","Middle/High School","22%",33.5,0.8,19.3,8.4,20.3,51.6,42.2,57.8,17.8,595,"63"
"390","25Q425","John Bowne High School","397","451","395","High School","19%",68.2,24.7,34.3,19.2,40.7,5.2,49.2,50.8,9.8,3660,"558"
"391","25Q460","Flushing High School","393","441","382","High School","17%",67.6,20,19.9,26.5,49.8,3.2,55.8,44.2,11.7,3113,"347"
"393","25Q525","Townsend Harris High School","621","651","638","High School","30%",29.2,0,55.5,5.9,12.9,24.6,28.9,71.1,0.2,1140,"278"
"394","25Q540","Queens Academy High School","398","382","388","Transfer High School","26%",63.7,6.4,15.8,42.3,35.9,5.4,59.4,40.6,8.9,404,"17"
"395","25Q670","Robert F. Kennedy Community High School","431","458","441","High School","23%",46.4,7.5,28.4,11.5,35.4,24.5,53.8,46.2,18.4,721,"99"
"396","25Q792","North Queens Community High School","379","421","377","Transfer High School","49%",54.1,1.5,10.1,42.4,33.3,14.1,45.5,54.5,11.6,198,"7"
"397","26Q415","Benjamin N. Cardozo High School","480","545","489","High School","16%",37.3,6.1,45.7,18.4,18.6,16.8,47.4,52.6,11.5,3912,"888"
"398","26Q430","Francis Lewis High School","468","539","467","High School","24%",51.6,13.2,51.9,8.3,24.1,15.5,49.2,50.8,12.3,4152,"934"
"399","26Q435","Martin Van Buren High School","391","397","384","High School","5%",38.2,9.9,24.1,56.4,15.1,2.9,54.3,45.7,11.5,2390,"334"
"400","26Q495","Bayside High School","462","523","464","High School","14%",52.4,5.7,45.2,12.7,22.3,19.6,49.4,50.6,10.6,3308,"708"
"401","26Q566","Queens High School Of Teaching, Liberal Arts And T","425","434","420","High School","25%",39.5,2.5,23.8,46.3,16.8,12.3,45.8,54.2,13.9,1196,"175"
"402","27Q260","Frederick Douglass Academy Vi High School","387","385","373","High School","43%",57.1,4,3.8,67,27,1.3,52.6,47.4,13.9,445,"87"
"403","27Q262","Channel View School For Research","432","419","401","Middle/High School","47%",58,1.3,5.7,55.2,27.5,11.2,51.1,48.9,10.5,636,"74"
"404","27Q302","Queens High School For Information, Research, And","391","401","364","High School","48%",75.7,10.6,4.2,60.3,30,4.5,54.5,45.5,16.1,310,"44"
"405","27Q308","Robert H. Goddard High School Of Communication Art","423","426","416","High School","64%",66.4,3.6,26.8,7.6,42.6,21.8,48.1,51.9,15.9,578,"93"
"406","27Q309","Academy Of Medical Technology: A College Board Sch","367","379","348","Middle/High School","38%",64.2,10.6,9.1,52.6,34.2,3.2,43.8,56.2,14,527,"36"
"407","27Q323","Scholars' Academy","499","537","496","Middle/High School","84%",35.9,0,22,19.2,15.9,41.6,43.9,56.1,1,1062,"89"
"408","27Q400","August Martin High School","377","371","360","High School","17%",65.1,4.3,6.2,79.9,11.5,1.7,55.2,44.8,16.5,1029,"101"
"409","27Q410","Beach Channel High School","384","396","354","High School","6%",65.5,11.3,2,46.8,44.3,6.3,57.5,42.5,21.8,684,"78"
"410","27Q475","Richmond Hill High School","382","404","368","High School","15%",61.8,17.4,32.9,16.8,46.4,3.2,53,47,13.7,2585,"404"
"411","27Q480","John Adams High School","391","409","392","High School","14%",75.5,16,27.5,27.7,37.1,3.6,54.5,45.5,12.1,3386,"403"
"412","27Q650","High School For Construction Trades, Engineering A","429","491","425","High School","30%",53.7,0.4,30.7,11.3,41.6,15.4,67.3,32.7,5.8,924,"194"
"413","28Q284","York Early College Academy","s","s","s","Middle/High School","31%",60.2,0,23.5,64.2,10.2,0.6,51.1,48.9,9.6,489,"s"
"414","28Q310","Queens Collegiate: A College Board School","420","445","400","Middle/High School","15%",61.5,8.1,27,49,18.5,3,49.9,50.1,12.3,529,"68"
"415","28Q325","Hillside Arts & Letters Academy","s","s","s","High School","45%",65.6,12.5,28,39,21,6.5,47,53,11,200,"s"
"416","28Q338","Queens Satellite High School For Opportunity","403","408","367","Transfer High School","3%",74.5,2,2.4,61.4,17.5,10,45.4,54.6,6,251,"6"
"417","28Q350","Jamaica Gateway To The Sciences","430","452","425","High School","21%",60,4.5,45.1,36.6,15.2,2.7,46.4,53.6,7.1,224,"25"
"418","28Q440","Forest Hills High School","456","497","454","High School","11%",41.2,8.9,26.5,9,30.2,33.7,48.1,51.9,11.3,3834,"762"
"419","28Q470","Jamaica High School","342","368","353","High School","22%",55.8,29.4,31,41.7,25.9,1.1,58.9,41.1,14,564,"90"
"420","28Q505","Hillcrest High School","395","413","386","High School","43%",65,15,36.5,36.6,22.8,2.9,46.1,53.9,9,3103,"462"
"421","28Q620","Thomas A. Edison Career And Technical Education Hi","452","478","442","High School","55%",54.3,1.4,50.9,23.7,21.1,3.2,65.1,34.9,11.4,2252,"422"
"422","28Q680","Queens Gateway To Health Sciences Secondary School","513","523","502","Middle/High School","32%",55.8,0.1,36.5,44.8,15.7,2.7,38.1,61.9,1.7,783,"99"
"423","28Q686","Queens Metropolitan High School","s","s","s","High School","19%",47.3,3.6,12.1,4.8,38.6,40.4,49.6,50.4,16,663,"s"
"424","28Q687","Queens High School For The Sciences At York Colleg","612","660","596","High School","28%",25.6,0.2,74.4,10.5,7.9,6.7,56.5,43.5,0.2,418,"121"
"425","28Q690","High School For Law Enforcement And Public Safety","406","406","384","High School","23%",58.3,2.1,8.4,73.7,15.1,1.3,53,47,16.6,536,"74"
"426","28Q896","Young Women'S Leadership School, Queens","439","445","432","Middle/High School","71%",56.9,2.7,21,57.3,18.4,2.4,0,100,9,510,"68"
"427","29Q248","Queens Preparatory Academy","360","380","359","High School","25%",52.6,4.5,5.2,84.4,8.2,0.9,56,44,11.3,441,"52"
"428","29Q259","Pathways College Preparatory School: A College Boa","401","397","375","Middle/High School","15%",48.8,2.3,2.2,94.2,2.9,0.7,53.3,46.7,16,555,"46"
"429","29Q265","Excelsior Preparatory High School","402","398","402","High School","26%",50.8,2.3,4.3,82.8,9.7,0.5,56.9,43.1,14.7,443,"49"
"430","29Q272","George Washington Carver High School For The Scien","436","427","424","High School","20%",45,1.7,9.3,73.8,14.1,1.3,47.3,52.7,9.1,474,"59"
"431","29Q283","Preparatory Academy For Writers: A College Board S","370","367","363","Middle/High School","15%",51.2,1.9,3.4,84.1,10.4,0.8,43.1,56.9,14.4,473,"43"
"432","29Q326","Cambria Heights Academy","s","s","s","High School","87%",71.1,2,3.4,87.1,7.5,2,55.1,44.9,13.6,147,"s"
"433","29Q492","Mathematics, Science Research And Technology Magne","400","426","394","High School","76%",47.9,5.1,6.8,79.6,11.9,0.7,60.4,39.6,10.4,412,"78"
"434","29Q494","Law, Government And Community Service High School","385","377","377","High School","26%",45.1,2.9,4.4,83.3,10.6,0.9,48.7,51.3,13.9,454,"52"
"435","29Q496","Business, Computer Applications & Entrepreneurship","379","414","359","High School","26%",43.5,6.5,6.2,85.3,5.4,0.8,67.1,32.9,19,353,"49"
"436","29Q498","Humanities & Arts Magnet High School","393","381","377","High School","45%",51.5,3.5,4,85.9,8.5,1.5,42.8,57.2,14.8,481,"62"
"437","30Q286","Young Women's Leadership School, Astoria","s","s","s","Middle/High School","87%",68.1,5.5,39.2,4.2,40.4,16.2,0,100,5.3,495,"s"
"438","30Q301","Academy For Careers In Television And Film","410","440","405","High School","66%",54.1,2.9,6,20.5,53.5,18.9,53.2,46.8,14.6,419,"98"
"439","30Q445","William Cullen Bryant High School","414","449","412","High School","43%",33.7,17.9,28.9,7.3,48.8,14.5,53.7,46.3,12.1,2945,"395"
"440","30Q450","Long Island City High School","403","420","395","High School","9%",62.8,13.2,13.2,11.4,62.7,12.5,51.3,48.7,13.8,3386,"392"
"441","30Q501","Frank Sinatra School Of The Arts High School","504","496","494","High School","34%",29.7,0.1,8.7,16.9,27.2,46.3,30,70,1.9,756,"174"
"442","30Q502","Information Technology High School","407","434","398","High School","29%",73.7,9.6,15.6,18.1,56.6,9.4,71.8,28.2,16,917,"148"
"443","30Q555","Newcomers High School","323","475","329","High School","51%",81.2,90.3,48.3,5.6,43.5,2.6,53.2,46.8,0,932,"143"
"444","30Q575","Academy Of American Studies","487","492","491","High School","40%",52.4,5.7,29.1,6.8,34.7,29.4,45,55,8,704,"135"
"445","30Q580","Baccalaureate School For Global Education","524","568","544","Middle/High School","35%",32.2,0,34.8,3.2,24.3,37.3,44.8,55.2,0.2,440,"61"
"446","31R047","Csi High School For International Studies","452","451","450","High School","70%",29,0.2,11.5,12,17.9,58.5,41.5,58.5,13.9,532,"137"
"447","31R064","Gaynor Mccown Expeditionary Learning School","398","412","385","High School","53%",35.4,1,5.9,15.7,17.6,60,52,48,22.8,408,"61"
"448","31R080","The Michael J. Petrides School","472","488","466","Elementary/Middle/High School","37%",32.3,1.6,8.1,18.8,16.9,55.9,49.2,50.8,18.5,1308,"107"
"449","31R440","New Dorp High School","424","437","416","High School","50%",42.3,5.9,7,12.1,27.3,53.3,52.5,47.5,16.9,2658,"391"
"450","31R445","Port Richmond High School","424","438","417","High School","22%",53.3,5.3,6.8,30.9,37.6,24.2,54.8,45.2,20.9,2151,"271"
"451","31R450","Curtis High School","437","435","429","High School","61%",54.3,6.1,7.3,38.4,31.9,21.8,46.4,53.6,14.7,2552,"375"
"452","31R455","Tottenville High School","462","486","470","High School","25%",18.4,1.4,5.4,2.1,9.9,82.1,49.6,50.4,13.9,3875,"807"
"453","31R460","Susan E. Wagner High School","455","474","459","High School","57%",41.4,3.4,14.6,11.3,24.1,49.4,50.8,49.2,18.8,3243,"535"
"454","31R470","Concord High School","466","455","414","Transfer High School","42%",56.9,2.2,1.7,38,39.7,19.6,45.8,54.2,17.3,179,"10"
"455","31R600","Ralph R. Mckee Career And Technical Education High","416","422","397","High School","32%",59.7,3.6,4.6,40.3,33.2,21.6,67.1,32.9,26.2,675,"94"
"456","31R605","Staten Island Technical High School","635","682","636","High School","92%",17,0.1,31.8,1.1,5.3,61.3,57,43,0.5,1104,"227"
"458","32K403","Academy For Environmental Leadership","380","366","352","High School","47%",88.7,32.9,0.6,21,77.1,0.8,50,50,17.7,362,"50"
"459","32K545","Ebc High School For Public ServiceBushwick","384","409","361","High School","53%",86.9,15.3,1.7,9.2,88.1,0.7,52.1,47.9,12.2,606,"88"
"460","32K549","Bushwick School For Social Justice","348","353","334","High School","43%",75.1,18.2,0.5,28.3,68.7,1.8,48.4,51.6,18.4,434,"75"
"461","32K552","Academy Of Urban Planning","342","364","354","High School","28%",77.1,23.9,1.5,26.4,70.4,1,54.5,45.5,22.1,398,"67"
"462","32K554","All City Leadership Secondary School","428","465","422","Middle/High School","46%",81.4,2.7,5.3,12.9,79.5,1.5,52.1,47.9,4.9,263,"39"
"463","32K556","Bushwick Leaders High School For Academic Excellen","347","358","350","High School","33%",88,18.2,0.9,21.2,77.3,0,53.2,46.8,18.6,462,"23"
"464","32K564","Bushwick Community High School","359","317","358","Transfer High School","40%",81.8,5.2,0.3,35.9,61.5,1.8,44.2,55.8,9.4,382,"24"
